{
  "$schema": "https://mcp-armor.com/spec/v1.0/armor.schema.json",
  "version": "1.0",
  "min_spec": "1.0",
  "profile": "network",
  "locked": false,
  "network": {
    "allow": [
      "api.github.com:443",
      "github.com:443"
    ],
    "deny_local": true,
    "deny_metadata": true
  },
  "spawn": false,
  "env": {
    "allow": ["GITHUB_TOKEN"]
  },
  "output": {
    "scan_secrets": true
  },
  "audit": {
    "enabled": true,
    "redact_params": true
  },
  "_source": "team-authored",
  "_reviewed_by": "mcparmor-core-team",
  "_reviewed_at": "2026-03-27T00:00:00Z"
}
