{
  "$schema": "https://mcp-armor.com/spec/v1.0/armor.schema.json",
  "version": "1.0",
  "min_spec": "1.0",
  "profile": "sandboxed",
  "locked": false,
  "filesystem": {
    "read": [
      "/tmp/mcparmor/*.db",
      "/tmp/mcparmor/*.sqlite"
    ],
    "write": [
      "/tmp/mcparmor/*.db",
      "/tmp/mcparmor/*.sqlite"
    ]
  },
  "spawn": false,
  "output": {
    "scan_secrets": false
  },
  "audit": {
    "enabled": true,
    "redact_params": false
  },
  "_source": "team-authored",
  "_reviewed_by": "mcparmor-core-team",
  "_reviewed_at": "2026-03-27T00:00:00Z"
}
